{"artifact_kind":"validation","baseline":{"path":"artifacts/explorer-mx-a64z/block-023/lane-a-baseline.v1.json","sha256":"c8afcc18f0a36213be2825db334be3a57da03ece477f0b771e3804b8067fa95a"},"created_at_utc":"2026-06-20T08:25:02Z","disposition_authority":"none — diff observation; gatekeeper disposes","mode":"explorer","namespace":"swift-r64z / mx-a64z","regressions":[],"result":"pass","run":{"path":"artifacts/explorer-mx-a64z/block-023/lane-a-run/lane-a-vectors.v1.json","sha256":"2af860e0074ebe818833ef6e14f1e2bbc4ccde2ddcfb6c80b99945a7840de59d"},"schema":"swift-r64z.lane-a-diff.v1","semantics":{"missing_vector":"a baseline vector (probe_id+key) absent from the run","new_vector":"run vector not in baseline; observed, non-regressing (expansion)","value_changed":"any load-bearing field (size/stride/alignment, overflow semantics, witness result, string counts) differs baseline->run"}}
